Filename,Name,Contact Information,Education,Work Experience,Skills
xyz.pdf,xyz,78948xxxxx,"Diploma, High School,  Computer Science Engineering","Software Engineer, Software Developer","Python, Teamwork, Communication, Artificial Intelligence, Natural Language Processing, Time Management, "
co_assignment_4.pdf,co_assignment_4,,,,
new resume.pdf,new resume,,"High School,  Computer Science Engineering",,"Python, Java, Machine Learning, SQL, HTML, Time Management, "
soumyaranjan sahoo.pdf,soumyaranjan sahoo,7894828883,"Diploma, High School,  Computer Science Engineering","Software Engineer, Software Developer","Python, Teamwork, Communication, Artificial Intelligence, Natural Language Processing, Time Management, "
soumyaranjan sahoo.pdf,soumyaranjan sahoo,7894828883, Computer Science Engineering,"Software Developer, Model","Python, Java, Machine Learning, Data Analysis, SQL, JavaScript, HTML, Teamwork, Communication, Artificial Intelligence, Natural Language Processing, Web Development, Leadership, Time Management, Adaptability, Creativity, Critical Thinking, Project Management, "
soumyaranjan sahoo.pdf,soumyaranjan sahoo,7894828883,Computer Science Engineering,"Software Developer, Model","Python, Java, Machine Learning, Data Analysis, SQL, JavaScript, HTML, Teamwork, Communication, Artificial Intelligence, Natural Language Processing, Web Development, Leadership, Time Management, Adaptability, Creativity, Critical Thinking, Project Management, "
